{
  "schema_version": "aoa_delegation_adapter_v1",
  "adapter_id": "abyss_stack_ephemeral_read_worker_v1",
  "adapter_kind": "local_provider",
  "delegation_class": "ephemeral_read_worker_v1",
  "abi_version": "aoa_delegation_class_v1",
  "provider_neutral_abi": true,
  "uses_builtin_codex_subagents": false,
  "enabled_by_default": false,
  "command": ["abyss-ephemeral-read-worker", "--json"]
}
